{
  "$schema": "../contracts/registry/catalog.schema.json",
  "schemaVersion": 1,
  "name": "aifrontkit",
  "homepage": "https://aifrontkit.dev",
  "items": [
    { "name": "conversation", "type": "registry:component", "title": "Conversation", "description": "Accessible transcript and scroll-follow presentation.", "targets": [{ "framework": "react", "flavor": "css-modules", "manifest": "registry/react/css/components/conversation/registry.json" }] },
    { "name": "message", "type": "registry:component", "title": "AI message", "description": "Accessible source-owned message presentation.", "targets": [{ "framework": "react", "flavor": "css-modules", "manifest": "registry/react/css/components/message/registry.json" }] },
    { "name": "file", "type": "registry:component", "title": "File", "description": "Composable attachment with safe download behavior.", "targets": [{ "framework": "react", "flavor": "css-modules", "manifest": "registry/react/css/components/file/registry.json" }] },
    { "name": "prompt-input", "type": "registry:component", "title": "Prompt input", "description": "Composable prompt input with submit behavior.", "targets": [{ "framework": "react", "flavor": "css-modules", "manifest": "registry/react/css/components/prompt-input/registry.json" }] },
    { "name": "tool-call", "type": "registry:component", "title": "Tool call", "description": "Status-aware tool call presentation.", "targets": [{ "framework": "react", "flavor": "css-modules", "manifest": "registry/react/css/components/tool-call/registry.json" }] },
    { "name": "tool-approval", "type": "registry:block", "title": "Tool approval", "description": "Explicit consequential-action approval pattern.", "targets": [{ "framework": "react", "flavor": "css-modules", "manifest": "registry/react/css/patterns/tool-approval/registry.json" }] },
    { "name": "agent-progress", "type": "registry:block", "title": "Agent progress", "description": "Runtime-bound long-running agent task and step progress.", "targets": [{ "framework": "react", "flavor": "css-modules", "manifest": "registry/react/css/patterns/agent-progress/registry.json" }] }
  ]
}
